{
  "version": 1,
  "kind": "response",
  "slice": "identity-service",
  "model": {
    "requirements": [
      {
        "title": "Identity API contract",
        "domain": "identity",
        "claims": [
          { "source": "docs", "id": "identity-api.contract", "kind": "requirement" }
        ],
        "statement": "The identity API exposes authentication and account-access endpoints.\n\n#### Scenario: Contract is served\n\n- GIVEN the published contract\n- WHEN a client calls an endpoint\n- THEN the service honours the contract"
      },
      {
        "title": "Login issues session token",
        "domain": "identity",
        "claims": [
          { "source": "legacy", "id": "identity-api.login", "kind": "requirement" }
        ],
        "statement": "Login issues a session token for valid credentials.\n\n#### Scenario: Valid credentials\n\n- GIVEN a registered user\n- WHEN they submit correct credentials\n- THEN they receive a session token"
      }
    ],
    "tasks": [
      { "id": "TASK-001", "text": "Implement the identity API surface.", "satisfies": ["REQ-001"] },
      { "id": "TASK-002", "text": "Implement login session issuance.", "satisfies": ["REQ-002"] }
    ]
  },
  "artifacts": {
    "proposal": "# Identity service\nImplement the identity service against the merged contracts.\n",
    "design": "# Design\nAuthentication and account-access service.\n",
    "tasks": "# Tasks\n- [ ] TASK-001 Implement the identity API surface.\n- [ ] TASK-002 Implement login session issuance.\n",
    "specs": [
      { "domain": "identity", "content": "## Identity service\nImplements authentication and account access.\n" }
    ]
  }
}
